{
  "additionalRelations": [
    {
      "childKey": "country.kosovo",
      "parentKey": "region.europe",
      "primary": true,
      "relationType": "contains",
      "taxonomyKey": "taxonomy.editorial.v1"
    }
  ],
  "decks": [
    {
      "key": "deck.all",
      "kind": "curated",
      "members": "all-current",
      "names": {
        "en": {
          "description": "Every flag, with no regions to lean on.",
          "name": "All countries"
        },
        "ru": {
          "description": "\u0412\u0441\u0435 \u0444\u043b\u0430\u0433\u0438 \u043f\u043e\u0434\u0440\u044f\u0434, \u0431\u0435\u0437 \u0440\u0430\u0437\u0431\u0438\u0432\u043a\u0438 \u043f\u043e \u0440\u0435\u0433\u0438\u043e\u043d\u0430\u043c.",
          "name": "\u0412\u0441\u0435 \u0441\u0442\u0440\u0430\u043d\u044b"
        }
      }
    },
    {
      "key": "deck.europe",
      "kind": "taxonomy",
      "members": {
        "taxonomy": "region.europe"
      },
      "names": {
        "en": {
          "description": "European flags.",
          "name": "Europe"
        },
        "ru": {
          "description": "\u0424\u043b\u0430\u0433\u0438 \u0415\u0432\u0440\u043e\u043f\u044b.",
          "name": "\u0415\u0432\u0440\u043e\u043f\u0430"
        }
      }
    },
    {
      "key": "deck.editorial-picks",
      "kind": "curated",
      "members": ["country.france", "country.japan"],
      "names": {
        "en": {
          "description": "A hand-picked pair.",
          "name": "Picks"
        }
      }
    }
  ],
  "defaultLocale": "ru",
  "entities": [
    {
      "identifiers": {
        "isoAlpha2": "FR",
        "isoAlpha3": "FRA"
      },
      "includeInCountryCatalog": true,
      "key": "country.france",
      "recognitionStatus": "un_member",
      "status": "active",
      "type": "country"
    },
    {
      "includeInCountryCatalog": true,
      "key": "country.japan",
      "overrides": {
        "names.ru.short": "\u042f\u043f\u043e\u043d\u0438\u044f"
      },
      "recognitionStatus": "un_member",
      "status": "active",
      "type": "country"
    },
    {
      "includeInCountryCatalog": false,
      "key": "region.europe",
      "recognitionStatus": "not_applicable",
      "status": "active",
      "type": "region"
    }
  ],
  "schemaVersion": 1,
  "sourceAliases": {
    "flagcdn": "flag-icons"
  },
  "supportedLocales": ["ru", "en"],
  "assetOverrides": [
    {
      "entityKey": "country.france",
      "assetType": "flag",
      "aspectRatio": 1.5,
      "license": "CC0-1.0",
      "sourceUrl": "https://commons.wikimedia.org/wiki/File:Flag_of_France.svg",
      "attribution": "Wikimedia Commons",
      "reason": "The upstream drawing used the wrong shade of blue."
    }
  ]
}
